Enter password: ******
Welcome to the MySQL monitor.  Commands end with ; or \g.
Your MySQL connection id is 21
Server version: 5.5.62 MySQL Community Server (GPL)

Copyright (c) 2000, 2018, Oracle and/or its affiliates. All rights reserved.

Oracle is a registered trademark of Oracle Corporation and/or its
affiliates. Other names may be trademarks of their respective
owners.

Type 'help;' or '\h' for help. Type '\c' to clear the current input statement.

mysql> use sse;
Database changed
mysql> select*from faculty;
+-------+---------+-------+---------+-----------+
| idno  | name    | dept  | address | hod       |
+-------+---------+-------+---------+-----------+
| 87664 | goutham | ai    | kurnool | saravanan |
| 64323 | deepa   | cse   | vellore | devi      |
| 95327 | lokesh  | mech  | chennai | raghu     |
| 75425 | kavitha | ece   | guntur  | pdrl      |
| 64378 | seetha  | civil | hyd     | hari      |
+-------+---------+-------+---------+-----------+
5 rows in set (0.00 sec)

mysql> update faculty set dept="bme" where idno=64323;
Query OK, 1 row affected (0.01 sec)
Rows matched: 1  Changed: 1  Warnings: 0

mysql> select*from faculty;
+-------+---------+-------+---------+-----------+
| idno  | name    | dept  | address | hod       |
+-------+---------+-------+---------+-----------+
| 87664 | goutham | ai    | kurnool | saravanan |
| 64323 | deepa   | bme   | vellore | devi      |
| 95327 | lokesh  | mech  | chennai | raghu     |
| 75425 | kavitha | ece   | guntur  | pdrl      |
| 64378 | seetha  | civil | hyd     | hari      |
+-------+---------+-------+---------+-----------+
5 rows in set (0.00 sec)

mysql> update faculty set address="vellore"where dept="cse";
Query OK, 0 rows affected (0.00 sec)
Rows matched: 0  Changed: 0  Warnings: 0

mysql> update faculty set address="tpt"where dept="cse";
Query OK, 0 rows affected (0.00 sec)
Rows matched: 0  Changed: 0  Warnings: 0

mysql> select*from faculty;
+-------+---------+-------+---------+-----------+
| idno  | name    | dept  | address | hod       |
+-------+---------+-------+---------+-----------+
| 87664 | goutham | ai    | kurnool | saravanan |
| 64323 | deepa   | bme   | vellore | devi      |
| 95327 | lokesh  | mech  | chennai | raghu     |
| 75425 | kavitha | ece   | guntur  | pdrl      |
| 64378 | seetha  | civil | hyd     | hari      |
+-------+---------+-------+---------+-----------+
5 rows in set (0.00 sec)

mysql> delete from faculty where hod="ram";
Query OK, 0 rows affected (0.00 sec)

mysql> select*from faculty;
+-------+---------+-------+---------+-----------+
| idno  | name    | dept  | address | hod       |
+-------+---------+-------+---------+-----------+
| 87664 | goutham | ai    | kurnool | saravanan |
| 64323 | deepa   | bme   | vellore | devi      |
| 95327 | lokesh  | mech  | chennai | raghu     |
| 75425 | kavitha | ece   | guntur  | pdrl      |
| 64378 | seetha  | civil | hyd     | hari      |
+-------+---------+-------+---------+-----------+
5 rows in set (0.00 sec)

mysql> delete from faculty where hod="pdrl";
Query OK, 1 row affected (0.00 sec)

mysql> select*from faculty:
    -> '\c'
    -> hgch
    -> \c
mysql> select*from faculty;
+-------+---------+-------+---------+-----------+
| idno  | name    | dept  | address | hod       |
+-------+---------+-------+---------+-----------+
| 87664 | goutham | ai    | kurnool | saravanan |
| 64323 | deepa   | bme   | vellore | devi      |
| 95327 | lokesh  | mech  | chennai | raghu     |
| 64378 | seetha  | civil | hyd     | hari      |
+-------+---------+-------+---------+-----------+
4 rows in set (0.00 sec)

mysql>